{
  "lock_version": 1,
  "name": "lmcache-shared-fs/chat-64-slots",
  "runs": [
    {
      "name": "lmcache_shared_fs",
      "abstract": "kvcache/lmcache-shared-fs/lmcache_shared_fs.ast.json",
      "ast_sha256": "2f895fd237fb993e88607ce7251f7b62b03d98a3514e2ad086075d21c9d621c6",
      "params": {
        "buf": {"default": {"from": "st_blksize", "of": "kv", "fallback": 1048576}},
        "chunk_bytes": {"default": 33554432},
        "chunk_tokens": {"default": 256},
        "concurrency": {"default": 64},
        "context": {"default": 8192},
        "decode_per_token": {"default": 12000000},
        "first_in": {"default": {"const": -1}},
        "keep": {"default": {"empirical": {"values": [0, 1000000], "weights": [91, 9]}}},
        "kind": {"default": {"const": 0}},
        "meta_bytes": {"default": 28},
        "prefill_per_token": {"default": 40000},
        "prefill_step": {"default": 8192},
        "requests": {"default": 20000},
        "retain": {"default": 5000},
        "reuse": {"default": {"mixture": [{"weight": 0.15, "dist": null}, {"weight": 0.85, "dist": {"const": 40}}]}},
        "sub_held": {"default": {"const": 0}},
        "sub_per_slot": {"default": false},
        "sub_pop": {"default": {"zipf": {"s": 1.1}}},
        "sub_prompts": {"default": 50},
        "sub_tokens": {"default": 1500},
        "sub_tokens_max": {"default": 100000},
        "sub_tokens_min": {"default": 1},
        "sys_held": {"default": {"const": 0}},
        "sys_local": {"default": true},
        "sys_per_slot": {"default": false},
        "sys_pop": {"default": {"zipf": {"s": 1.1}}},
        "sys_prompts": {"default": 50},
        "sys_tokens": {"default": 1500},
        "sys_tokens_max": {"default": 100000},
        "sys_tokens_min": {"default": 1},
        "think": {"default": {"const": 0}},
        "trim": {"default": {"const": 0}},
        "turn_in": {"default": {"empirical": {"values": [1, 4, 6, 7, 9, 10, 11, 13, 15, 17, 19, 22, 26, 31, 39, 50, 68, 107, 214, 944], "weights": [1, 1, 1, 1, 1, 1, 1, 1, 1, 1, 1, 1, 1, 1, 1, 1, 1, 1, 1, 1]}}},
        "turn_out": {"default": {"empirical": {"values": [12, 34, 62, 92, 119, 148, 175, 201, 225, 248, 271, 294, 317, 342, 370, 407, 454, 519, 615, 785], "weights": [1, 1, 1, 1, 1, 1, 1, 1, 1, 1, 1, 1, 1, 1, 1, 1, 1, 1, 1, 1]}}},
        "turns": {"default": {"const": 0}},
        "warm": {"default": 2000}
      },
      "sources": {
        "buf": "abstract",
        "chunk_bytes": "kvcache/lmcache-shared-fs/cases/chat-64-slots/writer.params.json",
        "chunk_tokens": "abstract",
        "concurrency": "kvcache/lmcache-shared-fs/cases/chat-64-slots/writer.params.json",
        "context": "kvcache/lmcache-shared-fs/cases/chat-64-slots/writer.params.json",
        "decode_per_token": "kvcache/lmcache-shared-fs/cases/chat-64-slots/writer.params.json",
        "first_in": "abstract",
        "keep": "kvcache/lmcache-shared-fs/cases/chat-64-slots/writer.params.json",
        "kind": "abstract",
        "meta_bytes": "abstract",
        "prefill_per_token": "kvcache/lmcache-shared-fs/cases/chat-64-slots/writer.params.json",
        "prefill_step": "kvcache/lmcache-shared-fs/cases/chat-64-slots/writer.params.json",
        "requests": "kvcache/lmcache-shared-fs/cases/chat-64-slots/writer.params.json",
        "retain": "kvcache/lmcache-shared-fs/cases/chat-64-slots/writer.params.json",
        "reuse": "kvcache/lmcache-shared-fs/cases/chat-64-slots/writer.params.json",
        "sub_held": "abstract",
        "sub_per_slot": "abstract",
        "sub_pop": "abstract",
        "sub_prompts": "abstract",
        "sub_tokens": "abstract",
        "sub_tokens_max": "abstract",
        "sub_tokens_min": "abstract",
        "sys_held": "abstract",
        "sys_local": "abstract",
        "sys_per_slot": "abstract",
        "sys_pop": "kvcache/lmcache-shared-fs/cases/chat-64-slots/writer.params.json",
        "sys_prompts": "kvcache/lmcache-shared-fs/cases/chat-64-slots/writer.params.json",
        "sys_tokens": "kvcache/lmcache-shared-fs/cases/chat-64-slots/writer.params.json",
        "sys_tokens_max": "abstract",
        "sys_tokens_min": "abstract",
        "think": "abstract",
        "trim": "abstract",
        "turn_in": "kvcache/lmcache-shared-fs/cases/chat-64-slots/writer.params.json",
        "turn_out": "kvcache/lmcache-shared-fs/cases/chat-64-slots/writer.params.json",
        "turns": "abstract",
        "warm": "kvcache/lmcache-shared-fs/cases/chat-64-slots/writer.params.json"
      }
    },
    {
      "name": "lmcache_shared_fs_reader",
      "abstract": "kvcache/lmcache-shared-fs/lmcache_shared_fs_reader.ast.json",
      "ast_sha256": "18258eee5c9c56924e1f2a9ac4cfb375a47368d06b51e7b9af3b2713510a7b9d",
      "params": {
        "buf": {"default": {"from": "st_blksize", "of": "kv", "fallback": 1048576}},
        "chunk_bytes": {"default": 33554432},
        "chunk_tokens": {"default": 256},
        "concurrency": {"default": 64},
        "context": {"default": 8192},
        "decode_per_token": {"default": 12000000},
        "first_in": {"default": {"const": -1}},
        "keep": {"default": {"empirical": {"values": [0, 1000000], "weights": [91, 9]}}},
        "kind": {"default": {"const": 0}},
        "meta_bytes": {"default": 28},
        "prefill_per_token": {"default": 40000},
        "prefill_step": {"default": 8192},
        "requests": {"default": 20000},
        "retain": {"default": 5000},
        "reuse": {"default": {"mixture": [{"weight": 0.15, "dist": null}, {"weight": 0.85, "dist": {"const": 40}}]}},
        "sub_held": {"default": {"const": 0}},
        "sub_per_slot": {"default": false},
        "sub_pop": {"default": {"zipf": {"s": 1.1}}},
        "sub_prompts": {"default": 50},
        "sub_tokens": {"default": 1500},
        "sub_tokens_max": {"default": 100000},
        "sub_tokens_min": {"default": 1},
        "sys_held": {"default": {"const": 0}},
        "sys_local": {"default": true},
        "sys_per_slot": {"default": false},
        "sys_pop": {"default": {"zipf": {"s": 1.1}}},
        "sys_prompts": {"default": 50},
        "sys_tokens": {"default": 1500},
        "sys_tokens_max": {"default": 100000},
        "sys_tokens_min": {"default": 1},
        "think": {"default": {"const": 0}},
        "trim": {"default": {"const": 0}},
        "turn_in": {"default": {"empirical": {"values": [1, 4, 6, 7, 9, 10, 11, 13, 15, 17, 19, 22, 26, 31, 39, 50, 68, 107, 214, 944], "weights": [1, 1, 1, 1, 1, 1, 1, 1, 1, 1, 1, 1, 1, 1, 1, 1, 1, 1, 1, 1]}}},
        "turn_out": {"default": {"empirical": {"values": [12, 34, 62, 92, 119, 148, 175, 201, 225, 248, 271, 294, 317, 342, 370, 407, 454, 519, 615, 785], "weights": [1, 1, 1, 1, 1, 1, 1, 1, 1, 1, 1, 1, 1, 1, 1, 1, 1, 1, 1, 1]}}},
        "turns": {"default": {"const": 0}},
        "warm": {"default": 2000}
      },
      "sources": {
        "buf": "abstract",
        "chunk_bytes": "kvcache/lmcache-shared-fs/cases/chat-64-slots/reader.params.json",
        "chunk_tokens": "abstract",
        "concurrency": "kvcache/lmcache-shared-fs/cases/chat-64-slots/reader.params.json",
        "context": "kvcache/lmcache-shared-fs/cases/chat-64-slots/reader.params.json",
        "decode_per_token": "kvcache/lmcache-shared-fs/cases/chat-64-slots/reader.params.json",
        "first_in": "abstract",
        "keep": "kvcache/lmcache-shared-fs/cases/chat-64-slots/reader.params.json",
        "kind": "abstract",
        "meta_bytes": "abstract",
        "prefill_per_token": "kvcache/lmcache-shared-fs/cases/chat-64-slots/reader.params.json",
        "prefill_step": "kvcache/lmcache-shared-fs/cases/chat-64-slots/reader.params.json",
        "requests": "kvcache/lmcache-shared-fs/cases/chat-64-slots/reader.params.json",
        "retain": "kvcache/lmcache-shared-fs/cases/chat-64-slots/reader.params.json",
        "reuse": "kvcache/lmcache-shared-fs/cases/chat-64-slots/reader.params.json",
        "sub_held": "abstract",
        "sub_per_slot": "abstract",
        "sub_pop": "abstract",
        "sub_prompts": "abstract",
        "sub_tokens": "abstract",
        "sub_tokens_max": "abstract",
        "sub_tokens_min": "abstract",
        "sys_held": "abstract",
        "sys_local": "abstract",
        "sys_per_slot": "abstract",
        "sys_pop": "kvcache/lmcache-shared-fs/cases/chat-64-slots/reader.params.json",
        "sys_prompts": "kvcache/lmcache-shared-fs/cases/chat-64-slots/reader.params.json",
        "sys_tokens": "kvcache/lmcache-shared-fs/cases/chat-64-slots/reader.params.json",
        "sys_tokens_max": "abstract",
        "sys_tokens_min": "abstract",
        "think": "abstract",
        "trim": "abstract",
        "turn_in": "kvcache/lmcache-shared-fs/cases/chat-64-slots/reader.params.json",
        "turn_out": "kvcache/lmcache-shared-fs/cases/chat-64-slots/reader.params.json",
        "turns": "abstract",
        "warm": "kvcache/lmcache-shared-fs/cases/chat-64-slots/reader.params.json"
      }
    }
  ],
  "provenance": {
    "tool": "aeiou-params lock",
    "case": "kvcache/lmcache-shared-fs/cases/chat-64-slots/case.toml",
    "fragments": [{"path": "kvcache/lmcache-shared-fs/cases/chat-64-slots/reader.params.json", "sha256": "67bcbd3dc766bdfc8f5668298ed3b2598737d7d86d68e05ae0fdf61072bf5366"}, {"path": "kvcache/lmcache-shared-fs/cases/chat-64-slots/writer.params.json", "sha256": "0550b32a911fb6b2cae5abbc9429b762da9b52b4da39a12ee127e8564604b3ca"}]
  }
}
