{
  "lock_version": 1,
  "name": "lmcache-local-disk/agentx-odirect",
  "runs": [
    {
      "name": "lmcache_local_disk",
      "abstract": "kvcache/lmcache-local-disk/lmcache_local_disk.ast.json",
      "ast_sha256": "16f242b5087cb86ea7ce2bc0f97871d017861b65c7598a810b4363ab1872374e",
      "params": {
        "chunk_bytes": {"default": 3145728},
        "chunk_tokens": {"default": 256},
        "concurrency": {"default": 8},
        "context": {"default": 131072},
        "decode_per_token": {"default": 12000000},
        "direct": {"default": true},
        "first_in": {"default": {"const": -1}},
        "keep": {"default": {"empirical": {"values": [0, 0, 0, 0, 0, 0, 0, 0, 0, 0, 0, 0, 0, 0, 0, 2442, 25370, 38966, 42368, 65641], "weights": [1, 1, 1, 1, 1, 1, 1, 1, 1, 1, 1, 1, 1, 1, 1, 1, 1, 1, 1, 1]}}},
        "kind": {"default": {"const": 0}},
        "prefill_per_token": {"default": 40000},
        "prefill_step": {"default": 2048},
        "requests": {"default": 28},
        "retain": {"default": 223},
        "reuse": {"default": {"mixture": [{"weight": 0, "dist": null}, {"weight": 1, "dist": {"const": 1}}]}},
        "sub_held": {"default": {"const": 0}},
        "sub_per_slot": {"default": false},
        "sub_pop": {"default": {"zipf": {"s": 1.1}}},
        "sub_prompts": {"default": 50},
        "sub_tokens": {"default": 1500},
        "sub_tokens_max": {"default": 100000},
        "sub_tokens_min": {"default": 1},
        "sys_held": {"default": {"const": 0}},
        "sys_local": {"default": false},
        "sys_per_slot": {"default": true},
        "sys_pop": {"default": {"zipf": {"s": 1.1}}},
        "sys_prompts": {"default": 8},
        "sys_tokens": {"default": 23424},
        "sys_tokens_max": {"default": 23424},
        "sys_tokens_min": {"default": 23424},
        "think": {"default": {"const": 0}},
        "trim": {"default": {"mixture": [{"weight": 0.9888, "dist": {"const": 0}}, {"weight": 0.0112, "dist": {"empirical": {"values": [282, 26148], "weights": [1, 1]}}}]}},
        "turn_in": {"default": {"empirical": {"values": [0, 0, 0, 8, 70, 200, 334, 572, 817, 1068, 1389, 1878, 2779, 3896, 5963, 8148, 11561, 15645, 24709, 38780], "weights": [1, 1, 1, 1, 1, 1, 1, 1, 1, 1, 1, 1, 1, 1, 1, 1, 1, 1, 1, 1]}}},
        "turn_out": {"default": {"empirical": {"values": [34, 83, 101, 121, 156, 186, 236, 282, 338, 385, 461, 546, 617, 723, 815, 1067, 1549, 2195, 2989, 5140], "weights": [1, 1, 1, 1, 1, 1, 1, 1, 1, 1, 1, 1, 1, 1, 1, 1, 1, 1, 1, 1]}}},
        "turns": {"default": {"empirical": {"values": [1, 1, 1, 1, 1, 1, 1, 1, 1, 1, 1, 1, 1, 1, 1, 1, 1, 1, 1, 1, 1, 1, 2, 2, 2, 2, 3, 3, 4, 4, 4, 5, 5, 6, 6, 6, 8, 11, 12, 12, 13, 14, 19, 27, 31], "weights": [1, 1, 1, 1, 1, 1, 1, 1, 1, 1, 1, 1, 1, 1, 1, 1, 1, 1, 1, 1, 1, 1, 1, 1, 1, 1, 1, 1, 1, 1, 1, 1, 1, 1, 1, 1, 1, 1, 1, 1, 1, 1, 1, 1, 1]}}},
        "warm": {"default": 0}
      },
      "sources": {
        "chunk_bytes": "kvcache/lmcache-local-disk/cases/agentx-odirect/params.json",
        "chunk_tokens": "kvcache/lmcache-local-disk/cases/agentx-odirect/params.json",
        "concurrency": "kvcache/lmcache-local-disk/cases/agentx-odirect/params.json",
        "context": "kvcache/lmcache-local-disk/cases/agentx-odirect/params.json",
        "decode_per_token": "kvcache/lmcache-local-disk/cases/agentx-odirect/params.json",
        "direct": "kvcache/lmcache-local-disk/cases/agentx-odirect/params.json",
        "first_in": "abstract",
        "keep": "kvcache/lmcache-local-disk/cases/agentx-odirect/params.json",
        "kind": "abstract",
        "prefill_per_token": "kvcache/lmcache-local-disk/cases/agentx-odirect/params.json",
        "prefill_step": "kvcache/lmcache-local-disk/cases/agentx-odirect/params.json",
        "requests": "kvcache/lmcache-local-disk/cases/agentx-odirect/params.json",
        "retain": "kvcache/lmcache-local-disk/cases/agentx-odirect/params.json",
        "reuse": "kvcache/lmcache-local-disk/cases/agentx-odirect/params.json",
        "sub_held": "abstract",
        "sub_per_slot": "abstract",
        "sub_pop": "abstract",
        "sub_prompts": "abstract",
        "sub_tokens": "abstract",
        "sub_tokens_max": "abstract",
        "sub_tokens_min": "abstract",
        "sys_held": "abstract",
        "sys_local": "kvcache/lmcache-local-disk/cases/agentx-odirect/params.json",
        "sys_per_slot": "kvcache/lmcache-local-disk/cases/agentx-odirect/params.json",
        "sys_pop": "kvcache/lmcache-local-disk/cases/agentx-odirect/params.json",
        "sys_prompts": "kvcache/lmcache-local-disk/cases/agentx-odirect/params.json",
        "sys_tokens": "kvcache/lmcache-local-disk/cases/agentx-odirect/params.json",
        "sys_tokens_max": "kvcache/lmcache-local-disk/cases/agentx-odirect/params.json",
        "sys_tokens_min": "kvcache/lmcache-local-disk/cases/agentx-odirect/params.json",
        "think": "kvcache/lmcache-local-disk/cases/agentx-odirect/params.json",
        "trim": "kvcache/lmcache-local-disk/cases/agentx-odirect/params.json",
        "turn_in": "kvcache/lmcache-local-disk/cases/agentx-odirect/params.json",
        "turn_out": "kvcache/lmcache-local-disk/cases/agentx-odirect/params.json",
        "turns": "kvcache/lmcache-local-disk/cases/agentx-odirect/params.json",
        "warm": "kvcache/lmcache-local-disk/cases/agentx-odirect/params.json"
      }
    }
  ],
  "provenance": {
    "tool": "aeiou-params lock",
    "case": "kvcache/lmcache-local-disk/cases/agentx-odirect/case.toml",
    "fragments": [{"path": "kvcache/lmcache-local-disk/cases/agentx-odirect/params.json", "sha256": "d394431b6f0fc9bac427584d57a43c9f31a6e08eead461f1be287b951f5139db"}]
  }
}
