{
  "lock_version": 1,
  "name": "lmcache-local-disk/agentx",
  "runs": [
    {
      "name": "lmcache_local_disk",
      "abstract": "kvcache/lmcache-local-disk/lmcache_local_disk.ast.json",
      "ast_sha256": "bbbec624eae7d9b6ba5308f4f2fad7392086f86e4ee86360f54601b886ee79d3",
      "params": {
        "chunk_bytes": {"default": 33554432},
        "chunk_tokens": {"default": 256},
        "concurrency": {"default": 1},
        "context": {"default": 990208},
        "decode_per_token": {"default": 12000000},
        "direct": {"default": false},
        "first_in": {"default": {"empirical": {"values": [61, 330, 472, 838, 1948, 2368, 2425, 2759, 2944, 2944, 2944, 2944, 2944, 2972, 3217, 5070, 7989, 12292, 21688, 97500], "weights": [1, 1, 1, 1, 1, 1, 1, 1, 1, 1, 1, 1, 1, 1, 1, 1, 1, 1, 1, 1]}}},
        "keep": {"default": {"empirical": {"values": [0, 1000000], "weights": [91, 9]}}},
        "kind": {"default": {"empirical": {"values": [0, 1, 2], "weights": [429, 722, 8928]}}},
        "prefill_per_token": {"default": 40000},
        "prefill_step": {"default": 8192},
        "requests": {"default": 98827},
        "retain": {"default": 98827},
        "reuse": {"default": {"mixture": [{"weight": 0, "dist": null}, {"weight": 1, "dist": {"const": 1}}]}},
        "sub_held": {"default": {"const": 0}},
        "sub_per_slot": {"default": false},
        "sub_pop": {"default": {"zipf": {"s": 1.1}}},
        "sub_prompts": {"default": 393},
        "sub_tokens": {"default": 29696},
        "sub_tokens_max": {"default": 29696},
        "sub_tokens_min": {"default": 29696},
        "sys_held": {"default": {"const": 0}},
        "sys_local": {"default": true},
        "sys_per_slot": {"default": false},
        "sys_pop": {"default": {"zipf": {"s": 1.1}}},
        "sys_prompts": {"default": 393},
        "sys_tokens": {"default": 32704},
        "sys_tokens_max": {"default": 32704},
        "sys_tokens_min": {"default": 32704},
        "think": {"default": {"empirical": {"values": [0, 0, 0, 0, 0, 372549167, 936557700, 1300294799, 1657325950, 2060344779, 2543778342, 3135802886, 3815600772, 4630781187, 5650701138, 6976889250, 9361805567, 22161961804, 80310622231, 4265488185291], "weights": [1, 1, 1, 1, 1, 1, 1, 1, 1, 1, 1, 1, 1, 1, 1, 1, 1, 1, 1, 1]}}},
        "trim": {"default": {"mixture": [{"weight": 0.9614, "dist": {"const": 0}}, {"weight": 0.0386, "dist": {"empirical": {"values": [266, 290, 320, 392, 409, 459, 475, 535, 585, 589, 594, 620, 1022, 2051, 3670, 6225, 11206, 47027, 107214, 450108], "weights": [1, 1, 1, 1, 1, 1, 1, 1, 1, 1, 1, 1, 1, 1, 1, 1, 1, 1, 1, 1]}}}]}},
        "turn_in": {"default": {"empirical": {"values": [0, 0, 0, 6, 55, 104, 156, 221, 312, 436, 587, 775, 959, 1124, 1332, 1671, 2276, 3419, 5792, 27088], "weights": [1, 1, 1, 1, 1, 1, 1, 1, 1, 1, 1, 1, 1, 1, 1, 1, 1, 1, 1, 1]}}},
        "turn_out": {"default": {"empirical": {"values": [40, 93, 119, 144, 174, 211, 254, 298, 351, 411, 481, 563, 672, 815, 999, 1232, 1583, 2204, 3358, 7546], "weights": [1, 1, 1, 1, 1, 1, 1, 1, 1, 1, 1, 1, 1, 1, 1, 1, 1, 1, 1, 1]}}},
        "turns": {"default": {"empirical": {"values": [1, 1, 1, 1, 1, 1, 1, 1, 1, 1, 1, 1, 1, 1, 1, 1, 1, 1, 1, 1, 1, 1, 1, 1, 1, 1, 1, 1, 1, 1, 1, 1, 1, 1, 1, 1, 1, 1, 1, 1, 1, 1, 1, 1, 1, 1, 1, 1, 1, 1, 1, 1, 1, 1, 1, 1, 1, 1, 1, 1, 1, 1, 1, 1, 1, 1, 1, 1, 1, 1, 1, 1, 1, 1, 1, 1, 1, 2, 2, 3, 3, 5, 6, 7, 8, 9, 10, 12, 14, 16, 19, 22, 25, 29, 34, 41, 53, 70, 119, 394], "weights": [1, 1, 1, 1, 1, 1, 1, 1, 1, 1, 1, 1, 1, 1, 1, 1, 1, 1, 1, 1, 1, 1, 1, 1, 1, 1, 1, 1, 1, 1, 1, 1, 1, 1, 1, 1, 1, 1, 1, 1, 1, 1, 1, 1, 1, 1, 1, 1, 1, 1, 1, 1, 1, 1, 1, 1, 1, 1, 1, 1, 1, 1, 1, 1, 1, 1, 1, 1, 1, 1, 1, 1, 1, 1, 1, 1, 1, 1, 1, 1, 1, 1, 1, 1, 1, 1, 1, 1, 1, 1, 1, 1, 1, 1, 1, 1, 1, 1, 1, 1]}}},
        "warm": {"default": 0}
      },
      "sources": {
        "chunk_bytes": "kvcache/lmcache-local-disk/cases/agentx/params.json",
        "chunk_tokens": "kvcache/lmcache-local-disk/cases/agentx/params.json",
        "concurrency": "kvcache/lmcache-local-disk/cases/agentx/params.json",
        "context": "kvcache/lmcache-local-disk/cases/agentx/params.json",
        "decode_per_token": "abstract",
        "direct": "abstract",
        "first_in": "kvcache/lmcache-local-disk/cases/agentx/params.json",
        "keep": "abstract",
        "kind": "kvcache/lmcache-local-disk/cases/agentx/params.json",
        "prefill_per_token": "abstract",
        "prefill_step": "abstract",
        "requests": "kvcache/lmcache-local-disk/cases/agentx/params.json",
        "retain": "kvcache/lmcache-local-disk/cases/agentx/params.json",
        "reuse": "kvcache/lmcache-local-disk/cases/agentx/params.json",
        "sub_held": "abstract",
        "sub_per_slot": "abstract",
        "sub_pop": "abstract",
        "sub_prompts": "kvcache/lmcache-local-disk/cases/agentx/params.json",
        "sub_tokens": "kvcache/lmcache-local-disk/cases/agentx/params.json",
        "sub_tokens_max": "kvcache/lmcache-local-disk/cases/agentx/params.json",
        "sub_tokens_min": "kvcache/lmcache-local-disk/cases/agentx/params.json",
        "sys_held": "abstract",
        "sys_local": "kvcache/lmcache-local-disk/cases/agentx/params.json",
        "sys_per_slot": "abstract",
        "sys_pop": "abstract",
        "sys_prompts": "kvcache/lmcache-local-disk/cases/agentx/params.json",
        "sys_tokens": "kvcache/lmcache-local-disk/cases/agentx/params.json",
        "sys_tokens_max": "kvcache/lmcache-local-disk/cases/agentx/params.json",
        "sys_tokens_min": "kvcache/lmcache-local-disk/cases/agentx/params.json",
        "think": "kvcache/lmcache-local-disk/cases/agentx/params.json",
        "trim": "kvcache/lmcache-local-disk/cases/agentx/params.json",
        "turn_in": "kvcache/lmcache-local-disk/cases/agentx/params.json",
        "turn_out": "kvcache/lmcache-local-disk/cases/agentx/params.json",
        "turns": "kvcache/lmcache-local-disk/cases/agentx/params.json",
        "warm": "kvcache/lmcache-local-disk/cases/agentx/params.json"
      }
    }
  ],
  "provenance": {
    "tool": "aeiou-params lock",
    "case": "kvcache/lmcache-local-disk/cases/agentx/case.toml",
    "fragments": [{"path": "kvcache/lmcache-local-disk/cases/agentx/params.json", "sha256": "e9b49575efa1baea33062431b0685db0c250f56a068db976a66f71e5a07e5872"}]
  }
}
