{
  "lock_version": 1,
  "name": "npy-per-sample/npy-140mib",
  "runs": [
    {
      "name": "npy_per_sample",
      "abstract": "input-pipeline/map/npy-per-sample/npy_per_sample.ast.json",
      "ast_sha256": "55b72b04751401f05c6f865bf0ba670af4eed47723ec32e603537bbadd2976bc",
      "params": {
        "batch": {"default": 2},
        "cd_len": {"default": 102},
        "files_per_directory": {"default": 10000},
        "framing": {"default": 498},
        "hdr_read": {"default": {"from": "st_blksize", "of": "train", "fallback": 1048576}},
        "inv_entry": {"default": 27},
        "inv_read": {"default": {"from": "st_blksize", "of": "train", "fallback": 1048576}},
        "inventory": {"default": false},
        "np_chunk": {"default": 262144},
        "prefetch": {"default": 2},
        "sample_mean": {"default": 146800640},
        "sample_sd": {"default": 4194304},
        "samples": {"default": 16},
        "step_time": {"default": 323000000},
        "steps": {"default": 16},
        "sync_every": {"default": 1},
        "walk": {"default": true},
        "workers": {"default": 2},
        "xfer": {"default": {"from": "st_blksize", "of": "train", "fallback": 1048576}}
      },
      "sources": {
        "batch": "input-pipeline/map/npy-per-sample/cases/npy-140mib/params.json",
        "cd_len": "abstract",
        "files_per_directory": "abstract",
        "framing": "abstract",
        "hdr_read": "abstract",
        "inv_entry": "abstract",
        "inv_read": "abstract",
        "inventory": "abstract",
        "np_chunk": "abstract",
        "prefetch": "input-pipeline/map/npy-per-sample/cases/npy-140mib/params.json",
        "sample_mean": "input-pipeline/map/npy-per-sample/cases/npy-140mib/params.json",
        "sample_sd": "input-pipeline/map/npy-per-sample/cases/npy-140mib/params.json",
        "samples": "input-pipeline/map/npy-per-sample/cases/npy-140mib/params.json",
        "step_time": "input-pipeline/map/npy-per-sample/cases/npy-140mib/params.json",
        "steps": "input-pipeline/map/npy-per-sample/cases/npy-140mib/params.json",
        "sync_every": "abstract",
        "walk": "abstract",
        "workers": "input-pipeline/map/npy-per-sample/cases/npy-140mib/params.json",
        "xfer": "abstract"
      }
    }
  ],
  "provenance": {
    "tool": "aeiou-params lock",
    "case": "input-pipeline/map/npy-per-sample/cases/npy-140mib/case.toml",
    "fragments": [{"path": "input-pipeline/map/npy-per-sample/cases/npy-140mib/params.json", "sha256": "5c80aaf500feef4adcf56bb680addf5cafd6621f2f37149ceae04df394cf28eb"}]
  }
}
