{
  "lock_version": 1,
  "name": "file-per-sample/jpeg-50m",
  "runs": [
    {
      "name": "file_per_sample",
      "abstract": "input-pipeline/map/file-per-sample/file_per_sample.ast.json",
      "ast_sha256": "848f089b1e5be070a5f55094699b40b8696b3dcdd4b1374075fa5edc00ff8c70",
      "params": {
        "batch": {"default": 32},
        "files_per_directory": {"default": 1300},
        "hdr_read": {"default": {"from": "st_blksize", "of": "train", "fallback": 1048576}},
        "inv_entry": {"default": 24},
        "inv_read": {"default": {"from": "st_blksize", "of": "train", "fallback": 1048576}},
        "inventory": {"default": false},
        "prefetch": {"default": 2},
        "sample_median": {"default": 112640},
        "samples": {"default": 50000000},
        "step_time": {"default": 105000000},
        "steps": {"default": 500},
        "sync_every": {"default": 1},
        "walk": {"default": true},
        "workers": {"default": 8}
      },
      "sources": {
        "batch": "input-pipeline/map/file-per-sample/cases/jpeg-50m/params.json",
        "files_per_directory": "abstract",
        "hdr_read": "abstract",
        "inv_entry": "abstract",
        "inv_read": "abstract",
        "inventory": "abstract",
        "prefetch": "input-pipeline/map/file-per-sample/cases/jpeg-50m/params.json",
        "sample_median": "input-pipeline/map/file-per-sample/cases/jpeg-50m/params.json",
        "samples": "input-pipeline/map/file-per-sample/cases/jpeg-50m/params.json",
        "step_time": "input-pipeline/map/file-per-sample/cases/jpeg-50m/params.json",
        "steps": "input-pipeline/map/file-per-sample/cases/jpeg-50m/params.json",
        "sync_every": "abstract",
        "walk": "abstract",
        "workers": "input-pipeline/map/file-per-sample/cases/jpeg-50m/params.json"
      }
    }
  ],
  "provenance": {
    "tool": "aeiou-params lock",
    "case": "input-pipeline/map/file-per-sample/cases/jpeg-50m/case.toml",
    "fragments": [{"path": "input-pipeline/map/file-per-sample/cases/jpeg-50m/params.json", "sha256": "cf313fe8a982c519b03e032610b8f822d55ce617e721c08272c5539e168e61c5"}]
  }
}
