{
  "lock_version": 1,
  "name": "dcp-load/four-items",
  "runs": [
    {
      "name": "dcp_load",
      "abstract": "checkpointing/dcp-load/dcp_load.ast.json",
      "ast_sha256": "b7f3bf97db57763935d86586f84409a81b76fc6b6123cad13a67580bed5423d9",
      "params": {
        "buf": {"default": {"from": "st_blksize", "of": "ckpt", "fallback": 1048576}},
        "eocd_scan": {"default": 4096},
        "hdr": {"default": 704},
        "item_bytes": {"default": [16777216, 33554432, 16777216, 8388608]},
        "item_off": {"default": [0, 16778793, 50334802, 67113595]},
        "items": {"default": 4},
        "meta_buf": {"default": {"from": "st_blksize", "of": "ckpt_meta", "fallback": 1048576}},
        "meta_bytes": {"default": 2097152},
        "read_order": {"default": [0, 1, 2, 3]},
        "rec2": {"default": 236},
        "replicas": {"default": 1},
        "restore_step": {"default": 100},
        "tail_back": {"default": [22, 42, 98, 561, 727, 857]},
        "trailer": {"default": 873}
      },
      "sources": {
        "buf": "abstract",
        "eocd_scan": "abstract",
        "hdr": "abstract",
        "item_bytes": "checkpointing/dcp-load/cases/four-items/params.json",
        "item_off": "checkpointing/dcp-load/cases/four-items/params.json",
        "items": "checkpointing/dcp-load/cases/four-items/params.json",
        "meta_buf": "abstract",
        "meta_bytes": "checkpointing/dcp-load/cases/four-items/params.json",
        "read_order": "checkpointing/dcp-load/cases/four-items/params.json",
        "rec2": "abstract",
        "replicas": "checkpointing/dcp-load/cases/four-items/params.json",
        "restore_step": "checkpointing/dcp-load/cases/four-items/params.json",
        "tail_back": "abstract",
        "trailer": "abstract"
      }
    }
  ],
  "provenance": {
    "tool": "aeiou-params lock",
    "case": "checkpointing/dcp-load/cases/four-items/case.toml",
    "fragments": [{"path": "checkpointing/dcp-load/cases/four-items/params.json", "sha256": "89f44dbca4f61546c604c32daf39d778d46f4f9c9399c278c8f42fb44d1e0830"}]
  }
}
