{
  "lock_version": 1,
  "name": "dcp-save/four-items",
  "runs": [
    {
      "name": "dcp_save",
      "abstract": "checkpointing/dcp-save/dcp_save.ast.json",
      "ast_sha256": "53013972da025aff82f5f41b9227b029b07df4132d25ac158c4ac228948503c6",
      "params": {
        "buf": {"default": {"from": "st_blksize", "of": "ckpt", "fallback": 1048576}},
        "ckpt_every": {"default": 100},
        "hdr": {"default": 704},
        "item_bytes": {"default": [16777216, 33554432, 16777216, 8388608]},
        "items": {"default": 4},
        "meta_bytes": {"default": 2097152},
        "readback": {"default": false},
        "step_time": {"default": 323000000},
        "steps": {"default": 500},
        "trailer": {"default": 873},
        "xfer": {"default": {"from": "st_blksize", "of": "ckpt", "fallback": 1048576}}
      },
      "sources": {
        "buf": "abstract",
        "ckpt_every": "checkpointing/dcp-save/cases/four-items/params.json",
        "hdr": "abstract",
        "item_bytes": "checkpointing/dcp-save/cases/four-items/params.json",
        "items": "checkpointing/dcp-save/cases/four-items/params.json",
        "meta_bytes": "checkpointing/dcp-save/cases/four-items/params.json",
        "readback": "abstract",
        "step_time": "checkpointing/dcp-save/cases/four-items/params.json",
        "steps": "checkpointing/dcp-save/cases/four-items/params.json",
        "trailer": "abstract",
        "xfer": "abstract"
      }
    }
  ],
  "provenance": {
    "tool": "aeiou-params lock",
    "case": "checkpointing/dcp-save/cases/four-items/case.toml",
    "fragments": [{"path": "checkpointing/dcp-save/cases/four-items/params.json", "sha256": "ff78179bf7ab2901daa93b1611d4b4cf696d6824d9c7cff29df7441475c6190e"}]
  }
}
