{
  "lock_version": 1,
  "name": "lmcache-local-disk/sharegpt-chat",
  "runs": [
    {
      "name": "lmcache_local_disk",
      "abstract": "kvcache/lmcache-local-disk/lmcache_local_disk.ast.json",
      "ast_sha256": "bbbec624eae7d9b6ba5308f4f2fad7392086f86e4ee86360f54601b886ee79d3",
      "params": {
        "chunk_bytes": {"default": 3145728},
        "chunk_tokens": {"default": 256},
        "concurrency": {"default": 1},
        "context": {"default": 4096},
        "decode_per_token": {"default": 12000000},
        "direct": {"default": false},
        "first_in": {"default": {"const": -1}},
        "keep": {"default": {"empirical": {"values": [38, 208, 208, 208, 208, 208, 208, 208, 208, 208, 208, 208, 208, 208, 308, 623, 1035, 1556, 3623, 4096], "weights": [1, 1, 1, 1, 1, 1, 1, 1, 1, 1, 1, 1, 1, 1, 1, 1, 1, 1, 1, 1]}}},
        "kind": {"default": {"const": 0}},
        "prefill_per_token": {"default": 40000},
        "prefill_step": {"default": 8192},
        "requests": {"default": 300},
        "retain": {"default": 300},
        "reuse": {"default": {"mixture": [{"weight": 0.1986, "dist": null}, {"weight": 0.8014, "dist": {"const": 8}}]}},
        "sub_held": {"default": {"const": 0}},
        "sub_per_slot": {"default": false},
        "sub_pop": {"default": {"zipf": {"s": 1.1}}},
        "sub_prompts": {"default": 50},
        "sub_tokens": {"default": 1500},
        "sub_tokens_max": {"default": 100000},
        "sub_tokens_min": {"default": 1},
        "sys_held": {"default": {"const": 0}},
        "sys_local": {"default": true},
        "sys_per_slot": {"default": false},
        "sys_pop": {"default": {"zipf": {"s": 1.1}}},
        "sys_prompts": {"default": 2},
        "sys_tokens": {"default": 466},
        "sys_tokens_max": {"default": 466},
        "sys_tokens_min": {"default": 466},
        "think": {"default": {"const": 0}},
        "trim": {"default": {"const": 0}},
        "turn_in": {"default": {"empirical": {"values": [12, 15, 17, 18, 20, 20, 22, 24, 26, 28, 30, 33, 36, 41, 50, 60, 77, 104, 166, 854], "weights": [1, 1, 1, 1, 1, 1, 1, 1, 1, 1, 1, 1, 1, 1, 1, 1, 1, 1, 1, 1]}}},
        "turn_out": {"default": {"empirical": {"values": [17, 47, 89, 124, 152, 175, 196, 215, 233, 245, 269, 292, 313, 346, 380, 439, 483, 545, 630, 761], "weights": [1, 1, 1, 1, 1, 1, 1, 1, 1, 1, 1, 1, 1, 1, 1, 1, 1, 1, 1, 1]}}},
        "turns": {"default": {"const": 0}},
        "warm": {"default": 0}
      },
      "sources": {
        "chunk_bytes": "kvcache/lmcache-local-disk/cases/sharegpt-chat/params.json",
        "chunk_tokens": "kvcache/lmcache-local-disk/cases/sharegpt-chat/params.json",
        "concurrency": "kvcache/lmcache-local-disk/cases/sharegpt-chat/params.json",
        "context": "kvcache/lmcache-local-disk/cases/sharegpt-chat/params.json",
        "decode_per_token": "abstract",
        "direct": "abstract",
        "first_in": "abstract",
        "keep": "kvcache/lmcache-local-disk/cases/sharegpt-chat/params.json",
        "kind": "abstract",
        "prefill_per_token": "abstract",
        "prefill_step": "abstract",
        "requests": "kvcache/lmcache-local-disk/cases/sharegpt-chat/params.json",
        "retain": "kvcache/lmcache-local-disk/cases/sharegpt-chat/params.json",
        "reuse": "kvcache/lmcache-local-disk/cases/sharegpt-chat/params.json",
        "sub_held": "abstract",
        "sub_per_slot": "abstract",
        "sub_pop": "abstract",
        "sub_prompts": "abstract",
        "sub_tokens": "abstract",
        "sub_tokens_max": "abstract",
        "sub_tokens_min": "abstract",
        "sys_held": "abstract",
        "sys_local": "kvcache/lmcache-local-disk/cases/sharegpt-chat/params.json",
        "sys_per_slot": "abstract",
        "sys_pop": "abstract",
        "sys_prompts": "kvcache/lmcache-local-disk/cases/sharegpt-chat/params.json",
        "sys_tokens": "kvcache/lmcache-local-disk/cases/sharegpt-chat/params.json",
        "sys_tokens_max": "kvcache/lmcache-local-disk/cases/sharegpt-chat/params.json",
        "sys_tokens_min": "kvcache/lmcache-local-disk/cases/sharegpt-chat/params.json",
        "think": "abstract",
        "trim": "abstract",
        "turn_in": "kvcache/lmcache-local-disk/cases/sharegpt-chat/params.json",
        "turn_out": "kvcache/lmcache-local-disk/cases/sharegpt-chat/params.json",
        "turns": "abstract",
        "warm": "kvcache/lmcache-local-disk/cases/sharegpt-chat/params.json"
      }
    }
  ],
  "provenance": {
    "tool": "aeiou-params lock",
    "case": "kvcache/lmcache-local-disk/cases/sharegpt-chat/case.toml",
    "fragments": [{"path": "kvcache/lmcache-local-disk/cases/sharegpt-chat/params.json", "sha256": "bc8a4c5cc79fa99a6de2f6a494bae2ae06fea860416ed5bf248df67fd0127769"}]
  }
}
