{
  "lock_version": 1,
  "name": "lmcache-local-disk/chat-64-slots",
  "runs": [
    {
      "name": "lmcache_local_disk",
      "abstract": "kvcache/lmcache-local-disk/lmcache_local_disk.ast.json",
      "ast_sha256": "16f242b5087cb86ea7ce2bc0f97871d017861b65c7598a810b4363ab1872374e",
      "params": {
        "chunk_bytes": {"default": 33554432},
        "chunk_tokens": {"default": 256},
        "concurrency": {"default": 64},
        "context": {"default": 8192},
        "decode_per_token": {"default": 12000000},
        "direct": {"default": false},
        "first_in": {"default": {"const": -1}},
        "keep": {"default": {"empirical": {"values": [0, 1000000], "weights": [91, 9]}}},
        "kind": {"default": {"const": 0}},
        "prefill_per_token": {"default": 40000},
        "prefill_step": {"default": 8192},
        "requests": {"default": 20000},
        "retain": {"default": 5000},
        "reuse": {"default": {"mixture": [{"weight": 0.15, "dist": null}, {"weight": 0.85, "dist": {"const": 40}}]}},
        "sub_held": {"default": {"const": 0}},
        "sub_per_slot": {"default": false},
        "sub_pop": {"default": {"zipf": {"s": 1.1}}},
        "sub_prompts": {"default": 50},
        "sub_tokens": {"default": 1500},
        "sub_tokens_max": {"default": 100000},
        "sub_tokens_min": {"default": 1},
        "sys_held": {"default": {"const": 0}},
        "sys_local": {"default": true},
        "sys_per_slot": {"default": false},
        "sys_pop": {"default": {"zipf": {"s": 1.1}}},
        "sys_prompts": {"default": 50},
        "sys_tokens": {"default": 1500},
        "sys_tokens_max": {"default": 100000},
        "sys_tokens_min": {"default": 1},
        "think": {"default": {"const": 0}},
        "trim": {"default": {"const": 0}},
        "turn_in": {"default": {"empirical": {"values": [1, 4, 6, 7, 9, 10, 11, 13, 15, 17, 19, 22, 26, 31, 39, 50, 68, 107, 214, 944], "weights": [1, 1, 1, 1, 1, 1, 1, 1, 1, 1, 1, 1, 1, 1, 1, 1, 1, 1, 1, 1]}}},
        "turn_out": {"default": {"empirical": {"values": [12, 34, 62, 92, 119, 148, 175, 201, 225, 248, 271, 294, 317, 342, 370, 407, 454, 519, 615, 785], "weights": [1, 1, 1, 1, 1, 1, 1, 1, 1, 1, 1, 1, 1, 1, 1, 1, 1, 1, 1, 1]}}},
        "turns": {"default": {"const": 0}},
        "warm": {"default": 2000}
      },
      "sources": {
        "chunk_bytes": "kvcache/lmcache-local-disk/cases/chat-64-slots/params.json",
        "chunk_tokens": "abstract",
        "concurrency": "kvcache/lmcache-local-disk/cases/chat-64-slots/params.json",
        "context": "kvcache/lmcache-local-disk/cases/chat-64-slots/params.json",
        "decode_per_token": "kvcache/lmcache-local-disk/cases/chat-64-slots/params.json",
        "direct": "abstract",
        "first_in": "abstract",
        "keep": "kvcache/lmcache-local-disk/cases/chat-64-slots/params.json",
        "kind": "abstract",
        "prefill_per_token": "kvcache/lmcache-local-disk/cases/chat-64-slots/params.json",
        "prefill_step": "kvcache/lmcache-local-disk/cases/chat-64-slots/params.json",
        "requests": "kvcache/lmcache-local-disk/cases/chat-64-slots/params.json",
        "retain": "kvcache/lmcache-local-disk/cases/chat-64-slots/params.json",
        "reuse": "kvcache/lmcache-local-disk/cases/chat-64-slots/params.json",
        "sub_held": "abstract",
        "sub_per_slot": "abstract",
        "sub_pop": "abstract",
        "sub_prompts": "abstract",
        "sub_tokens": "abstract",
        "sub_tokens_max": "abstract",
        "sub_tokens_min": "abstract",
        "sys_held": "abstract",
        "sys_local": "abstract",
        "sys_per_slot": "abstract",
        "sys_pop": "kvcache/lmcache-local-disk/cases/chat-64-slots/params.json",
        "sys_prompts": "kvcache/lmcache-local-disk/cases/chat-64-slots/params.json",
        "sys_tokens": "kvcache/lmcache-local-disk/cases/chat-64-slots/params.json",
        "sys_tokens_max": "abstract",
        "sys_tokens_min": "abstract",
        "think": "abstract",
        "trim": "abstract",
        "turn_in": "kvcache/lmcache-local-disk/cases/chat-64-slots/params.json",
        "turn_out": "kvcache/lmcache-local-disk/cases/chat-64-slots/params.json",
        "turns": "abstract",
        "warm": "kvcache/lmcache-local-disk/cases/chat-64-slots/params.json"
      }
    }
  ],
  "provenance": {
    "tool": "aeiou-params lock",
    "case": "kvcache/lmcache-local-disk/cases/chat-64-slots/case.toml",
    "fragments": [{"path": "kvcache/lmcache-local-disk/cases/chat-64-slots/params.json", "sha256": "9e562d1a716d5f557ca913d980be72c981a5b702542759bab38e8931df521646"}]
  }
}
