{
  "lock_version": 1,
  "name": "file-per-sample/imagefolder-jpeg",
  "runs": [
    {
      "name": "file_per_sample",
      "abstract": "input-pipeline/map/file-per-sample/file_per_sample.ast.json",
      "ast_sha256": "c23a6656eb966f92f0836168f70c3779329d4956646133d699bfa26d727ac2f4",
      "params": {
        "batch": {"default": 16},
        "files_per_directory": {"default": 1300},
        "hdr_read": {"default": 1048576},
        "inv_entry": {"default": 24},
        "inv_read": {"default": 1048576},
        "inventory": {"default": false},
        "prefetch": {"default": 2},
        "samples": {"default": 3200},
        "step_time": {"default": 105000000},
        "steps": {"default": 400},
        "sync_every": {"default": 1},
        "walk": {"default": true},
        "workers": {"default": 2}
      },
      "sources": {
        "batch": "input-pipeline/map/file-per-sample/cases/imagefolder-jpeg/params.json",
        "files_per_directory": "abstract",
        "hdr_read": "abstract",
        "inv_entry": "abstract",
        "inv_read": "abstract",
        "inventory": "abstract",
        "prefetch": "input-pipeline/map/file-per-sample/cases/imagefolder-jpeg/params.json",
        "samples": "input-pipeline/map/file-per-sample/cases/imagefolder-jpeg/params.json",
        "step_time": "abstract",
        "steps": "input-pipeline/map/file-per-sample/cases/imagefolder-jpeg/params.json",
        "sync_every": "abstract",
        "walk": "input-pipeline/map/file-per-sample/cases/imagefolder-jpeg/params.json",
        "workers": "input-pipeline/map/file-per-sample/cases/imagefolder-jpeg/params.json"
      }
    }
  ],
  "provenance": {
    "tool": "aeiou-params lock",
    "case": "input-pipeline/map/file-per-sample/cases/imagefolder-jpeg/case.toml",
    "fragments": [{"path": "input-pipeline/map/file-per-sample/cases/imagefolder-jpeg/params.json", "sha256": "e9897b286ca566e87c5868f0668efc99110e2d28586ca21180531a4effad31ad"}]
  }
}
