{
  "lock_version": 1,
  "name": "lmcache-shared-fs/sharegpt-chat",
  "runs": [
    {
      "name": "lmcache_shared_fs",
      "abstract": "kvcache/lmcache-shared-fs/lmcache_shared_fs.ast.json",
      "ast_sha256": "3d89da224f1b8ca4976bbdc87e170fc6dc4fd346fbe7793cdbcbc6888cd95902",
      "params": {
        "buf": {"default": 1048576},
        "chunk_bytes": {"default": 3145728},
        "chunk_tokens": {"default": 256},
        "concurrency": {"default": 1},
        "context": {"default": 4096},
        "decode_per_token": {"default": 12000000},
        "first_in": {"default": {"const": -1}},
        "keep": {"default": {"empirical": {"values": [38, 208, 208, 208, 208, 208, 208, 208, 208, 208, 208, 208, 208, 208, 308, 623, 1035, 1556, 3623, 4096], "weights": [1, 1, 1, 1, 1, 1, 1, 1, 1, 1, 1, 1, 1, 1, 1, 1, 1, 1, 1, 1]}}},
        "kind": {"default": {"const": 0}},
        "meta_bytes": {"default": 28},
        "prefill_per_token": {"default": 40000},
        "prefill_step": {"default": 8192},
        "requests": {"default": 300},
        "retain": {"default": 300},
        "reuse": {"default": {"mixture": [{"weight": 0.1986, "dist": null}, {"weight": 0.8014, "dist": {"const": 8}}]}},
        "sub_held": {"default": {"const": 0}},
        "sub_per_slot": {"default": false},
        "sub_pop": {"default": {"zipf": {"s": 1.1}}},
        "sub_prompts": {"default": 50},
        "sub_tokens": {"default": 1500},
        "sub_tokens_max": {"default": 100000},
        "sub_tokens_min": {"default": 1},
        "sys_held": {"default": {"const": 0}},
        "sys_local": {"default": true},
        "sys_per_slot": {"default": false},
        "sys_pop": {"default": {"zipf": {"s": 1.1}}},
        "sys_prompts": {"default": 2},
        "sys_tokens": {"default": 466},
        "sys_tokens_max": {"default": 466},
        "sys_tokens_min": {"default": 466},
        "think": {"default": {"const": 0}},
        "trim": {"default": {"const": 0}},
        "turn_in": {"default": {"empirical": {"values": [12, 15, 17, 18, 20, 20, 22, 24, 26, 28, 30, 33, 36, 41, 50, 60, 77, 104, 166, 854], "weights": [1, 1, 1, 1, 1, 1, 1, 1, 1, 1, 1, 1, 1, 1, 1, 1, 1, 1, 1, 1]}}},
        "turn_out": {"default": {"empirical": {"values": [17, 47, 89, 124, 152, 175, 196, 215, 233, 245, 269, 292, 313, 346, 380, 439, 483, 545, 630, 761], "weights": [1, 1, 1, 1, 1, 1, 1, 1, 1, 1, 1, 1, 1, 1, 1, 1, 1, 1, 1, 1]}}},
        "turns": {"default": {"const": 0}},
        "warm": {"default": 0}
      },
      "sources": {
        "buf": "kvcache/lmcache-shared-fs/cases/sharegpt-chat/writer.params.json",
        "chunk_bytes": "kvcache/lmcache-shared-fs/cases/sharegpt-chat/writer.params.json",
        "chunk_tokens": "kvcache/lmcache-shared-fs/cases/sharegpt-chat/writer.params.json",
        "concurrency": "kvcache/lmcache-shared-fs/cases/sharegpt-chat/writer.params.json",
        "context": "kvcache/lmcache-shared-fs/cases/sharegpt-chat/writer.params.json",
        "decode_per_token": "abstract",
        "first_in": "abstract",
        "keep": "kvcache/lmcache-shared-fs/cases/sharegpt-chat/writer.params.json",
        "kind": "abstract",
        "meta_bytes": "kvcache/lmcache-shared-fs/cases/sharegpt-chat/writer.params.json",
        "prefill_per_token": "abstract",
        "prefill_step": "abstract",
        "requests": "kvcache/lmcache-shared-fs/cases/sharegpt-chat/writer.params.json",
        "retain": "kvcache/lmcache-shared-fs/cases/sharegpt-chat/writer.params.json",
        "reuse": "kvcache/lmcache-shared-fs/cases/sharegpt-chat/writer.params.json",
        "sub_held": "abstract",
        "sub_per_slot": "abstract",
        "sub_pop": "abstract",
        "sub_prompts": "abstract",
        "sub_tokens": "abstract",
        "sub_tokens_max": "abstract",
        "sub_tokens_min": "abstract",
        "sys_held": "abstract",
        "sys_local": "kvcache/lmcache-shared-fs/cases/sharegpt-chat/writer.params.json",
        "sys_per_slot": "abstract",
        "sys_pop": "abstract",
        "sys_prompts": "kvcache/lmcache-shared-fs/cases/sharegpt-chat/writer.params.json",
        "sys_tokens": "kvcache/lmcache-shared-fs/cases/sharegpt-chat/writer.params.json",
        "sys_tokens_max": "kvcache/lmcache-shared-fs/cases/sharegpt-chat/writer.params.json",
        "sys_tokens_min": "kvcache/lmcache-shared-fs/cases/sharegpt-chat/writer.params.json",
        "think": "abstract",
        "trim": "abstract",
        "turn_in": "kvcache/lmcache-shared-fs/cases/sharegpt-chat/writer.params.json",
        "turn_out": "kvcache/lmcache-shared-fs/cases/sharegpt-chat/writer.params.json",
        "turns": "abstract",
        "warm": "kvcache/lmcache-shared-fs/cases/sharegpt-chat/writer.params.json"
      }
    },
    {
      "name": "lmcache_shared_fs_reader",
      "abstract": "kvcache/lmcache-shared-fs/lmcache_shared_fs_reader.ast.json",
      "ast_sha256": "42bdf8c3616fa38eeadcec4b4251f335111d82e44f935ff3245bc303c9d7384c",
      "params": {
        "buf": {"default": 1048576},
        "chunk_bytes": {"default": 3145728},
        "chunk_tokens": {"default": 256},
        "concurrency": {"default": 1},
        "context": {"default": 4096},
        "decode_per_token": {"default": 12000000},
        "first_in": {"default": {"const": -1}},
        "keep": {"default": {"empirical": {"values": [38, 208, 208, 208, 208, 208, 208, 208, 208, 208, 208, 208, 208, 208, 308, 623, 1035, 1556, 3623, 4096], "weights": [1, 1, 1, 1, 1, 1, 1, 1, 1, 1, 1, 1, 1, 1, 1, 1, 1, 1, 1, 1]}}},
        "kind": {"default": {"const": 0}},
        "meta_bytes": {"default": 28},
        "prefill_per_token": {"default": 40000},
        "prefill_step": {"default": 8192},
        "requests": {"default": 300},
        "retain": {"default": 300},
        "reuse": {"default": {"mixture": [{"weight": 0.1986, "dist": null}, {"weight": 0.8014, "dist": {"const": 8}}]}},
        "sub_held": {"default": {"const": 0}},
        "sub_per_slot": {"default": false},
        "sub_pop": {"default": {"zipf": {"s": 1.1}}},
        "sub_prompts": {"default": 50},
        "sub_tokens": {"default": 1500},
        "sub_tokens_max": {"default": 100000},
        "sub_tokens_min": {"default": 1},
        "sys_held": {"default": {"const": 0}},
        "sys_local": {"default": true},
        "sys_per_slot": {"default": false},
        "sys_pop": {"default": {"zipf": {"s": 1.1}}},
        "sys_prompts": {"default": 2},
        "sys_tokens": {"default": 466},
        "sys_tokens_max": {"default": 466},
        "sys_tokens_min": {"default": 466},
        "think": {"default": {"const": 0}},
        "trim": {"default": {"const": 0}},
        "turn_in": {"default": {"empirical": {"values": [12, 15, 17, 18, 20, 20, 22, 24, 26, 28, 30, 33, 36, 41, 50, 60, 77, 104, 166, 854], "weights": [1, 1, 1, 1, 1, 1, 1, 1, 1, 1, 1, 1, 1, 1, 1, 1, 1, 1, 1, 1]}}},
        "turn_out": {"default": {"empirical": {"values": [17, 47, 89, 124, 152, 175, 196, 215, 233, 245, 269, 292, 313, 346, 380, 439, 483, 545, 630, 761], "weights": [1, 1, 1, 1, 1, 1, 1, 1, 1, 1, 1, 1, 1, 1, 1, 1, 1, 1, 1, 1]}}},
        "turns": {"default": {"const": 0}},
        "warm": {"default": 0}
      },
      "sources": {
        "buf": "kvcache/lmcache-shared-fs/cases/sharegpt-chat/reader.params.json",
        "chunk_bytes": "kvcache/lmcache-shared-fs/cases/sharegpt-chat/reader.params.json",
        "chunk_tokens": "kvcache/lmcache-shared-fs/cases/sharegpt-chat/reader.params.json",
        "concurrency": "kvcache/lmcache-shared-fs/cases/sharegpt-chat/reader.params.json",
        "context": "kvcache/lmcache-shared-fs/cases/sharegpt-chat/reader.params.json",
        "decode_per_token": "abstract",
        "first_in": "abstract",
        "keep": "kvcache/lmcache-shared-fs/cases/sharegpt-chat/reader.params.json",
        "kind": "abstract",
        "meta_bytes": "kvcache/lmcache-shared-fs/cases/sharegpt-chat/reader.params.json",
        "prefill_per_token": "abstract",
        "prefill_step": "abstract",
        "requests": "kvcache/lmcache-shared-fs/cases/sharegpt-chat/reader.params.json",
        "retain": "kvcache/lmcache-shared-fs/cases/sharegpt-chat/reader.params.json",
        "reuse": "kvcache/lmcache-shared-fs/cases/sharegpt-chat/reader.params.json",
        "sub_held": "abstract",
        "sub_per_slot": "abstract",
        "sub_pop": "abstract",
        "sub_prompts": "abstract",
        "sub_tokens": "abstract",
        "sub_tokens_max": "abstract",
        "sub_tokens_min": "abstract",
        "sys_held": "abstract",
        "sys_local": "kvcache/lmcache-shared-fs/cases/sharegpt-chat/reader.params.json",
        "sys_per_slot": "abstract",
        "sys_pop": "abstract",
        "sys_prompts": "kvcache/lmcache-shared-fs/cases/sharegpt-chat/reader.params.json",
        "sys_tokens": "kvcache/lmcache-shared-fs/cases/sharegpt-chat/reader.params.json",
        "sys_tokens_max": "kvcache/lmcache-shared-fs/cases/sharegpt-chat/reader.params.json",
        "sys_tokens_min": "kvcache/lmcache-shared-fs/cases/sharegpt-chat/reader.params.json",
        "think": "abstract",
        "trim": "abstract",
        "turn_in": "kvcache/lmcache-shared-fs/cases/sharegpt-chat/reader.params.json",
        "turn_out": "kvcache/lmcache-shared-fs/cases/sharegpt-chat/reader.params.json",
        "turns": "abstract",
        "warm": "kvcache/lmcache-shared-fs/cases/sharegpt-chat/reader.params.json"
      }
    }
  ],
  "provenance": {
    "tool": "aeiou-params lock",
    "case": "kvcache/lmcache-shared-fs/cases/sharegpt-chat/case.toml",
    "fragments": [{"path": "kvcache/lmcache-shared-fs/cases/sharegpt-chat/reader.params.json", "sha256": "403d13251fd405834ba1bf9fc4fa6cce77be2bc6af4dc468761b4956cac8a549"}, {"path": "kvcache/lmcache-shared-fs/cases/sharegpt-chat/writer.params.json", "sha256": "9da1bf12c857e61a8c388f09a3302d46dd750bf3fc1650b3c470373a4a28c033"}]
  }
}
