{
  "lock_version": 1,
  "name": "dcp-load/name-order-17-items",
  "runs": [
    {
      "name": "dcp_load",
      "abstract": "checkpointing/dcp-load/dcp_load.ast.json",
      "ast_sha256": "bea867b79e9cf97bd93651842679689a860c90d370b26b951c1b37ad96f11af3",
      "params": {
        "buf": {"default": {"from": "st_blksize", "of": "ckpt", "fallback": 1048576}},
        "eocd_scan": {"default": 4096},
        "hdr": {"default": 704},
        "item_bytes": {"default": [16777216, 262144, 262144, 262144, 262144, 262144, 262144, 2096, 2096, 2096, 393216, 393216, 393216, 393216, 996144, 996144, 8388608]},
        "item_off": {"default": [0, 16778793, 17042514, 17306235, 17569956, 17833677, 18097398, 18361119, 18364744, 18368369, 18371994, 18766787, 19161580, 19556373, 19951166, 20948839, 21946512]},
        "items": {"default": 17},
        "meta_buf": {"default": {"from": "st_blksize", "of": "ckpt_meta", "fallback": 1048576}},
        "meta_bytes": {"default": 6916},
        "read_order": {"default": [0, 1, 10, 11, 12, 13, 14, 15, 16, 2, 3, 4, 5, 6, 7, 8, 9]},
        "rec2": {"default": 236},
        "replicas": {"default": 1},
        "restore_step": {"default": 300},
        "tail_back": {"default": [22, 42, 98, 561, 727, 857]},
        "trailer": {"default": 873}
      },
      "sources": {
        "buf": "abstract",
        "eocd_scan": "abstract",
        "hdr": "abstract",
        "item_bytes": "checkpointing/dcp-load/cases/name-order-17-items/params.json",
        "item_off": "checkpointing/dcp-load/cases/name-order-17-items/params.json",
        "items": "checkpointing/dcp-load/cases/name-order-17-items/params.json",
        "meta_buf": "abstract",
        "meta_bytes": "checkpointing/dcp-load/cases/name-order-17-items/params.json",
        "read_order": "checkpointing/dcp-load/cases/name-order-17-items/params.json",
        "rec2": "abstract",
        "replicas": "checkpointing/dcp-load/cases/name-order-17-items/params.json",
        "restore_step": "checkpointing/dcp-load/cases/name-order-17-items/params.json",
        "tail_back": "abstract",
        "trailer": "abstract"
      }
    }
  ],
  "provenance": {
    "tool": "aeiou-params lock",
    "case": "checkpointing/dcp-load/cases/name-order-17-items/case.toml",
    "fragments": [{"path": "checkpointing/dcp-load/cases/name-order-17-items/params.json", "sha256": "093c2c856fc2158949b7e2af80abeb56091cfc8198632f3d2927a90823019609"}]
  }
}
